<?xml version="1.0" encoding="UTF-8"?>
<?xml-stylesheet type="text/xsl" href="Employee.xsl"?>
<!DOCTYPE employees SYSTEM "Employee.dtd">
<employees>
    <employee>
        <id>1</id>
        <name>John Doe</name>
        <position>Software Engineer</position>
        <salary>80000</salary>
    </employee>
    <employee>
        <id>2</id>
        <name>Jane Smith</name>
        <position>Marketing Specialist</position>
        <salary>60000</salary>
    </employee>
    <employee>
        <id>3</id>
        <name>Michael Johnson</name>
        <position>Project Manager</position>
        <salary>90000</salary>
    </employee>
    <employee>
        <id>4</id>
        <name>Alice Brown</name>
        <position>HR Specialist</position>
        <salary>65000</salary>
    </employee>
    <employee>
        <id>5</id>
        <name>Robert White</name>
        <position>Database Administrator</position>
        <salary>85000</salary>
    </employee>
    <employee>
        <id>6</id>
        <name>Emily Davis</name>
        <position>Graphic Designer</position>
        <salary>70000</salary>
    </employee>
    <employee>
        <id>7</id>
        <name>Christopher Lee</name>
        <position>Financial Analyst</position>
        <salary>95000</salary>
    </employee>
    <employee>
        <id>8</id>
        <name>Sarah Turner</name>
        <position>Customer Support Specialist</position>
        <salary>55000</salary>
    </employee>
    <employee>
        <id>9</id>
        <name>Daniel Evans</name>
        <position>Network Engineer</position>
        <salary>82000</salary>
    </employee>
    <employee>
        <id>10</id>
        <name>Olivia Harris</name>
        <position>Sales Manager</position>
        <salary>88000</salary>
    </employee>
</employees>